<?xml version="1.0" encoding="UTF-8"?>
<standardEnergisticsPropertyTypeSet xmlns="http://www.f2i-consulting.com/PropertyTypeMapping" xmlns:xsi="http://www.w3.org/2001/XMLSchema-instance" xsi:schemaLocation="http://www.f2i-consulting.com/PropertyTypeMapping PropertyTypeMapping.xsd ">
	<standardEnergisticsPropertyType>
		<name>absorbed dose</name>
		<description>The amount of energy absorbed per mass.</description>
		<isAbstract>false</isAbstract>
		<parentKind>quantity</parentKind>
		<unitOfMeasure>Gy</unitOfMeasure>
		<dimensionalClass>L2/T2</dimensionalClass>
	</standardEnergisticsPropertyType>
	<standardEnergisticsPropertyType>
		<name>acceleration linear</name>
		<isAbstract>false</isAbstract>
		<parentKind>quantity</parentKind>
		<unitOfMeasure>m/s2</unitOfMeasure>
		<dimensionalClass>L/T2</dimensionalClass>
	</standardEnergisticsPropertyType>
	<standardEnergisticsPropertyType>
		<name>activity (of radioactivity)</name>
		<description>A measure of the radiation being emitted.</description>
		<isAbstract>false</isAbstract>
		<parentKind>quantity</parentKind>
		<unitOfMeasure>Bq</unitOfMeasure>
		<dimensionalClass>1/T</dimensionalClass>
	</standardEnergisticsPropertyType>
	<standardEnergisticsPropertyType>
		<name>amount of substance</name>
		<description>Molar amount of a substance.</description>
		<isAbstract>false</isAbstract>
		<parentKind>quantity</parentKind>
		<unitOfMeasure>mol</unitOfMeasure>
		<dimensionalClass>N</dimensionalClass>
	</standardEnergisticsPropertyType>
	<standardEnergisticsPropertyType>
		<name>amplitude</name>
		<description>Amplitude of the acoustic signal recorded. It is not a physical property, only a standardEnergisticsPropertyType.</description>
		<isAbstract>false</isAbstract>
		<parentKind>unitless</parentKind>
		<unitOfMeasure>Euc</unitOfMeasure>
		<dimensionalClass>0</dimensionalClass>
	</standardEnergisticsPropertyType>
	<standardEnergisticsPropertyType>
		<name>angle per length</name>
		<isAbstract>true</isAbstract>
		<parentKind>quantity</parentKind>
		<unitOfMeasure>rad/m</unitOfMeasure>
		<dimensionalClass>A/L</dimensionalClass>
	</standardEnergisticsPropertyType>
	<standardEnergisticsPropertyType>
		<name>angle per time</name>
		<description>The angular velocity. The rate of change of an angle.</description>
		<isAbstract>true</isAbstract>
		<parentKind>quantity</parentKind>
		<unitOfMeasure>rad/s</unitOfMeasure>
		<dimensionalClass>A/T</dimensionalClass>
	</standardEnergisticsPropertyType>
	<standardEnergisticsPropertyType>
		<name>angle per volume</name>
		<isAbstract>true</isAbstract>
		<parentKind>quantity</parentKind>
		<unitOfMeasure>rad/m3</unitOfMeasure>
		<dimensionalClass>A/L3</dimensionalClass>
	</standardEnergisticsPropertyType>
	<standardEnergisticsPropertyType>
		<name>angular acceleration</name>
		<isAbstract>false</isAbstract>
		<parentKind>quantity</parentKind>
		<unitOfMeasure>rad/s2</unitOfMeasure>
		<dimensionalClass>A/T2</dimensionalClass>
	</standardEnergisticsPropertyType>
	<standardEnergisticsPropertyType>
		<name>area</name>
		<isAbstract>false</isAbstract>
		<parentKind>quantity</parentKind>
		<unitOfMeasure>m2</unitOfMeasure>
		<dimensionalClass>L2</dimensionalClass>
	</standardEnergisticsPropertyType>
	<standardEnergisticsPropertyType>
		<name>area per area</name>
		<description>A dimensionless quantity where the basis of the ratio is area.</description>
		<isAbstract>true</isAbstract>
		<parentKind>dimensionless</parentKind>
		<unitOfMeasure>Euc</unitOfMeasure>
		<dimensionalClass>ratio(L2)</dimensionalClass>
	</standardEnergisticsPropertyType>
	<standardEnergisticsPropertyType>
		<name>area per volume</name>
		<isAbstract>true</isAbstract>
		<parentKind>quantity</parentKind>
		<unitOfMeasure>1/m</unitOfMeasure>
		<dimensionalClass>1/L</dimensionalClass>
	</standardEnergisticsPropertyType>
	<standardEnergisticsPropertyType>
		<name>attenuation</name>
		<description>A logarithmic, fractional change of some measure, generally power or amplitude, over a standard range. This is generally used for frequency attenuation over an octave.</description>
		<isAbstract>false</isAbstract>
		<parentKind>quantity</parentKind>
		<unitOfMeasure>B/O</unitOfMeasure>
		<dimensionalClass>1</dimensionalClass>
	</standardEnergisticsPropertyType>
	<standardEnergisticsPropertyType>
		<name>attenuation per length</name>
		<isAbstract>false</isAbstract>
		<parentKind>quantity</parentKind>
		<unitOfMeasure>B/m</unitOfMeasure>
		<dimensionalClass>1/L</dimensionalClass>
	</standardEnergisticsPropertyType>
	<standardEnergisticsPropertyType>
		<name>azimuth</name>
		<description>Angle between the North and the projection of the normal to the horizon surface estimated on a local area of the interface.</description>
		<isAbstract>false</isAbstract>
		<parentKind>plane angle</parentKind>
		<unitOfMeasure>rad</unitOfMeasure>
		<dimensionalClass>A</dimensionalClass>
	</standardEnergisticsPropertyType>
	<standardEnergisticsPropertyType>
		<name>bubble point pressure</name>
		<description>The pressure at which the first gas bubble appears while decreasing pressure on a fluid sample.</description>
		<isAbstract>false</isAbstract>
		<parentKind>pressure</parentKind>
		<unitOfMeasure>Pa</unitOfMeasure>
		<dimensionalClass>M/LT2</dimensionalClass>
	</standardEnergisticsPropertyType>
	<standardEnergisticsPropertyType>
		<name>bulk modulus</name>
		<description>Bulk modulus, K</description>
		<isAbstract>false</isAbstract>
		<parentKind>pressure</parentKind>
		<unitOfMeasure>Pa</unitOfMeasure>
		<dimensionalClass>M/LT2</dimensionalClass>
	</standardEnergisticsPropertyType>
	<standardEnergisticsPropertyType>
		<name>capacitance</name>
		<isAbstract>false</isAbstract>
		<parentKind>quantity</parentKind>
		<unitOfMeasure>F</unitOfMeasure>
		<dimensionalClass>C2T4/L2M</dimensionalClass>
	</standardEnergisticsPropertyType>
	<standardEnergisticsPropertyType>
		<name>categorical</name>
		<description>The abstract supertype of all enumerated string properties.</description>
		<isAbstract>true</isAbstract>
		<parentKind>RESQML root property</parentKind>
	</standardEnergisticsPropertyType>
	<standardEnergisticsPropertyType>
		<name>cell length</name>
		<description>distance from cell face center to cell face center in the specified direction, DI, DJ, DK</description>
		<isAbstract>false</isAbstract>
		<parentKind>length</parentKind>
		<unitOfMeasure>m</unitOfMeasure>
		<dimensionalClass>L</dimensionalClass>
	</standardEnergisticsPropertyType>
	<standardEnergisticsPropertyType>
		<name>charge density</name>
		<isAbstract>false</isAbstract>
		<parentKind>quantity</parentKind>
		<unitOfMeasure>C/m3</unitOfMeasure>
		<dimensionalClass>CT/L3</dimensionalClass>
	</standardEnergisticsPropertyType>
	<standardEnergisticsPropertyType>
		<name>chemical potential</name>
		<isAbstract>false</isAbstract>
		<parentKind>quantity</parentKind>
		<unitOfMeasure>J/mol</unitOfMeasure>
		<dimensionalClass>L2M/NT2</dimensionalClass>
	</standardEnergisticsPropertyType>
	<standardEnergisticsPropertyType>
		<name>code</name>
		<description>A discrete code.</description>
		<isAbstract>false</isAbstract>
		<parentKind>categorical</parentKind>
	</standardEnergisticsPropertyType>
	<standardEnergisticsPropertyType>
		<name>compressibility</name>
		<isAbstract>false</isAbstract>
		<parentKind>quantity</parentKind>
		<unitOfMeasure>1/Pa</unitOfMeasure>
		<dimensionalClass>LT2/M</dimensionalClass>
	</standardEnergisticsPropertyType>
	<standardEnergisticsPropertyType>
		<name>concentration of B</name>
		<description>molar concentration of a substance.</description>
		<isAbstract>false</isAbstract>
		<parentKind>quantity</parentKind>
		<unitOfMeasure>mol/m3</unitOfMeasure>
		<dimensionalClass>N/L3</dimensionalClass>
	</standardEnergisticsPropertyType>
	<standardEnergisticsPropertyType>
		<name>conductivity</name>
		<isAbstract>false</isAbstract>
		<parentKind>quantity</parentKind>
		<unitOfMeasure>S/m</unitOfMeasure>
		<dimensionalClass>C2T3/L3M</dimensionalClass>
	</standardEnergisticsPropertyType>
	<standardEnergisticsPropertyType>
		<name>continuous</name>
		<description>The abstract supertype of all floating point properties.</description>
		<isAbstract>true</isAbstract>
		<parentKind>RESQML root property</parentKind>
	</standardEnergisticsPropertyType>
	<standardEnergisticsPropertyType>
		<name>cross section absorption</name>
		<isAbstract>false</isAbstract>
		<parentKind>quantity</parentKind>
		<unitOfMeasure>m2/mol</unitOfMeasure>
		<dimensionalClass>L2/N</dimensionalClass>
	</standardEnergisticsPropertyType>
	<standardEnergisticsPropertyType>
		<name>current density</name>
		<isAbstract>false</isAbstract>
		<parentKind>quantity</parentKind>
		<unitOfMeasure>A/m2</unitOfMeasure>
		<dimensionalClass>C/L2</dimensionalClass>
	</standardEnergisticsPropertyType>
	<standardEnergisticsPropertyType>
		<name>Darcy flow coefficient</name>
		<isAbstract>false</isAbstract>
		<parentKind>quantity</parentKind>
		<unitOfMeasure>Pa/m3</unitOfMeasure>
		<dimensionalClass>M/L4T2</dimensionalClass>
	</standardEnergisticsPropertyType>
	<standardEnergisticsPropertyType>
		<name>data transmission speed</name>
		<description>used primarily for computer transmission rates.</description>
		<isAbstract>false</isAbstract>
		<parentKind>quantity</parentKind>
		<unitOfMeasure>bps</unitOfMeasure>
		<dimensionalClass>1/T</dimensionalClass>
	</standardEnergisticsPropertyType>
	<standardEnergisticsPropertyType>
		<name>delta temperature</name>
		<description>Delta temperature refers to temperature differences. For non-zero offset temperature scales, Fahrenheit and Celsius, the conversion formulas are different than for absolute temperatures.</description>
		<isAbstract>false</isAbstract>
		<parentKind>quantity</parentKind>